### ISSUE TITLE
Demo code examples do not work

### ISSUE THREAD

**Issue by dnesting** [JarryShaw/PyPCAPKit#270]
At https://jarryshaw.github.io/PyPCAPKit/demo.html you have three blocks of example code.  To the best of my searching, these appear to be the only three blocks of code demonstrating how to accomplish tasks using the API that exist on the internet.  Two out of the three blocks do not work (with minor edits to produce some kind of output).  I don't have enough familiarity with the package to say whether this is just documentation that hasn't kept up with API changes, or whether these represent bugs.

Code:

```python
from pcapkit import IP, extract

extraction = extract(fin="in.pcap", nofile=True)
frame0 = extraction.frame[0]
# check if IP (IPv4 or IPv6) in this frame
flag = IP in frame0
if IP in frame0:
    # fetch the IP packet from this frame
    ip = frame0[IP]
    print("Got IP:", repr(ip))
```

Output:

```

[WARNING] 05/11/2025 11:17:18 AM - EOF reached
```

---

Code:

```python
from pcapkit import HTTP, extract
# set strict to make sure full reassembly
extraction = extract(fin='in.pcap', store=False, nofile=True, reassembly=True, tcp=True, strict=True)
# print extracted packet if HTTP in reassembled payloads
for datagram in extraction.reassembly.tcp:
    if datagram.packet is not None and HTTP in datagram.packet:
        print(datagram.packet[HTTP])
```

Output:

```
Traceback (most recent call last):
  File ".../test/test.py", line 4, in <module>
    extraction = extract(
                 ^^^^^^^^
TypeError: extract() got an unexpected keyword argument 'strict'
```

---

After removing the `strict=True`, and adding some debugging prints:

```python
from pcapkit import HTTP, extract

# set strict to make sure full reassembly
extraction = extract(fin="in.pcap", store=False, nofile=True, reassembly=True, tcp=True)

print(type(extraction.reassembly.tcp))
print(len(extraction.reassembly.tcp))

for datagram in extraction.reassembly.tcp:
    if datagram.packet is not None:
        if HTTP in datagram.packet:
            print(datagram.packet[HTTP])
        else:
            print("No HTTP in this datagram")
    else:
        print("No packet in this datagram")
```

Output:

```
[INFO] 05/11/2025 11:20:45 AM - TCP reassembly enabled
[WARNING] 05/11/2025 11:20:45 AM - EOF reached
<class 'tuple'>
0
```

---

Confirming the `in.pcap` here ([attached](https://github.com/user-attachments/files/20149973/in.pcap.zip))  does in fact contain packets:

```
$ tcpdump -nr in.pcap
reading from file in.pcap, link-type NULL (BSD loopback)
10:54:26.177091 IP 127.0.0.1.55513 > 127.0.0.1.8080: Flags [S], seq 1343292241, win 65535, options [mss 16344,nop,wscale 6,nop,nop,TS val 2991820443 ecr 0,sackOK,eol], length 0
10:54:26.177190 IP 127.0.0.1.8080 > 127.0.0.1.55513: Flags [S.], seq 3556803839, ack 1343292242, win 65535, options [mss 16344,nop,wscale 6,nop,nop,TS val 196760132 ecr 2991820443,sackOK,eol], length 0
10:54:26.177212 IP 127.0.0.1.55513 > 127.0.0.1.8080: Flags [.], ack 1, win 6380, options [nop,nop,TS val 2991820443 ecr 196760132], length 0
10:54:26.177227 IP 127.0.0.1.8080 > 127.0.0.1.55513: Flags [.], ack 1, win 6380, options [nop,nop,TS val 196760132 ecr 2991820443], length 0
10:54:26.177257 IP 127.0.0.1.55513 > 127.0.0.1.8080: Flags [P.], seq 1:78, ack 1, win 6380, options [nop,nop,TS val 2991820443 ecr 196760132], length 77: HTTP: GET / HTTP/1.1
10:54:26.177281 IP 127.0.0.1.8080 > 127.0.0.1.55513: Flags [.], ack 78, win 6379, options [nop,nop,TS val 196760132 ecr 2991820443], length 0
10:54:26.179449 IP 127.0.0.1.8080 > 127.0.0.1.55513: Flags [P.], seq 1:120, ack 78, win 6379, options [nop,nop,TS val 196760135 ecr 2991820443], length 119: HTTP: HTTP/1.0 200 OK
10:54:26.179505 IP 127.0.0.1.55513 > 127.0.0.1.8080: Flags [.], ack 120, win 6379, options [nop,nop,TS val 2991820446 ecr 196760135], length 0
10:54:26.179579 IP 127.0.0.1.8080 > 127.0.0.1.55513: Flags [P.], seq 120:133, ack 78, win 6379, options [nop,nop,TS val 196760135 ecr 2991820446], length 13: HTTP
10:54:26.179602 IP 127.0.0.1.55513 > 127.0.0.1.8080: Flags [.], ack 133, win 6379, options [nop,nop,TS val 2991820446 ecr 196760135], length 0
10:54:26.179679 IP 127.0.0.1.8080 > 127.0.0.1.55513: Flags [F.], seq 133, ack 78, win 6379, options [nop,nop,TS val 196760135 ecr 2991820446], length 0
10:54:26.179707 IP 127.0.0.1.55513 > 127.0.0.1.8080: Flags [.], ack 134, win 6379, options [nop,nop,TS val 2991820446 ecr 196760135], length 0
10:54:26.179734 IP 127.0.0.1.55513 > 127.0.0.1.8080: Flags [F.], seq 78, ack 134, win 6379, options [nop,nop,TS val 2991820446 ecr 196760135], length 0
10:54:26.179772 IP 127.0.0.1.8080 > 127.0.0.1.55513: Flags [.], ack 79, win 6379, options [nop,nop,TS val 196760135 ecr 2991820446], length 0
```

**Comment by dnesting** [comment]
Ignore!  I just realized my testing was being done on localhost which does not contain ethernet frames!
